{
  "$schema": "https://memory-os.example/schemas/security/pairing-session.v1.schema.json",
  "schemaVersion": 1,
  "pairingSessionId": "pair_01J00000000000000000000000",
  "ownerAccountId": "acct_01J00000000000000000000000",
  "accountEpoch": 7,
  "deviceId": "device_01J000000000000000000000",
  "state": "active",
  "tokenHash": "bbbbbbbbbbbbbbbbbbbbbbbbbbbbbbbbbbbbbbbbbbbbbbbbbbbbbbbbbbbbbbbb",
  "allowedOperations": ["create_upload", "read_job_status", "submit_mapping", "read_preview_summary", "cancel_job"],
  "maxUses": 20,
  "usedCount": 2,
  "createdAt": "2026-07-16T01:00:00Z",
  "expiresAt": "2026-07-16T02:00:00Z",
  "security": {
    "finalApplyAllowed": false,
    "memoryReadAllowed": false,
    "tokenStoredRaw": false,
    "revocable": true
  }
}
